{
  "contract": "singleaxis.fabric.delivery-evidence", "version": "1.0.0",
  "batch": {
    "batch_id": "90000000-0000-4000-8000-000000000001", "stream_class": "audit", "destination_id": "a0000000-0000-4000-8000-000000000001", "created_at": "2026-08-31T10:00:03Z",
    "event_ids": ["10000000-0000-4000-8000-000000000001", "10000000-0000-4000-8000-000000000002", "10000000-0000-4000-8000-000000000003"],
    "source_ranges": [{"source_id": "50000000-0000-4000-8000-000000000001", "first_sequence": 1, "last_sequence": 3}],
    "payload": {"artifact": "contracts/activity/v2/valid/shadow-execution.json", "sha256": "36280babb2ca77ee9a9e771f80dea84a1f81b2ad7bf9da1b064fcba0ab17f55f", "digest_scope": "exact_file_bytes"},
    "privacy_assertion": {"assertion_id": "80000000-0000-4000-8000-000000000001", "artifact": "contracts/privacy/v1/valid/metadata-only-assertion.json", "sha256": "283f59e38d31f725171bd93ad520cfd11d84652180646e7c05e747364894d45e"}
  },
  "stages": [
    {"stage_event_id": "b0000000-0000-4000-8000-000000000001", "stage": "queued", "recorded_at": "2026-08-31T10:00:03Z", "actor": {"role": "fabric_node", "actor_id": "c0000000-0000-4000-8000-000000000001"}},
    {"stage_event_id": "b0000000-0000-4000-8000-000000000002", "stage": "transmitted", "recorded_at": "2026-08-31T10:00:04Z", "actor": {"role": "fabric_node", "actor_id": "c0000000-0000-4000-8000-000000000001"}},
    {"stage_event_id": "b0000000-0000-4000-8000-000000000003", "stage": "destination.accepted", "recorded_at": "2026-08-31T10:00:05Z", "actor": {"role": "destination", "actor_id": "a0000000-0000-4000-8000-000000000001"}, "acknowledgement": {"acknowledgement_id": "destination-ack-42", "issuer_destination_id": "a0000000-0000-4000-8000-000000000001", "batch_id": "90000000-0000-4000-8000-000000000001", "payload_sha256": "36280babb2ca77ee9a9e771f80dea84a1f81b2ad7bf9da1b064fcba0ab17f55f"}},
    {"stage_event_id": "b0000000-0000-4000-8000-000000000004", "stage": "destination.durably_persisted", "recorded_at": "2026-08-31T10:00:06Z", "actor": {"role": "destination", "actor_id": "a0000000-0000-4000-8000-000000000001"}, "destination_proof": {"proof_id": "destination-proof-42", "issuer_destination_id": "a0000000-0000-4000-8000-000000000001", "batch_id": "90000000-0000-4000-8000-000000000001", "payload_sha256": "36280babb2ca77ee9a9e771f80dea84a1f81b2ad7bf9da1b064fcba0ab17f55f", "issued_at": "2026-08-31T10:00:06Z", "key_id": "destination-key-2026-08", "algorithm": "ed25519", "signature": "ZmFrZS1zaWduYXR1cmUtZm9yLWNvbnRyYWN0LWZpeHR1cmU"}}
  ]
}
